{
  "$schema": "https://json-schema.org/draft/2020-12/schema",
  "$id": "urn:aces-scenario-pack:schema:provenance:v0",
  "version": "0.1.0",
  "title": "ACES Scenario Pack — Provenance (v0)",
  "description": "Records where a pack's content originated, who owns it, its scrub status, and its adoption impact. Records references only: it must not copy private source content, real credentials, operator tokens, private hosts, or customer data.",
  "type": "object",
  "required": ["packId", "sources", "scrubStatus"],
  "properties": {
    "packId": {"type": "string", "description": "Pack this provenance record applies to."},
    "sources": {
      "type": "array",
      "minItems": 1,
      "description": "Where the pack's content originated, expressed as references.",
      "items": {
        "type": "object",
        "required": ["origin"],
        "properties": {
          "origin": {"type": "string", "description": "Named origin of the content (a repository or authored-here marker)."},
          "ref": {"type": "string", "description": "A non-sensitive reference (path or identifier), never copied private content."},
          "note": {"type": "string", "description": "Short adoption note about this source."}
        }
      }
    },
    "scrubStatus": {
      "type": "string",
      "enum": ["scrubbed", "not-required", "pending"],
      "description": "Whether downstream-private names, paths, labels, statuses, and assumptions have been scrubbed."
    },
    "ownership": {"type": "string", "description": "Which boundary owns the content (ACES core, this repository, or a consumer)."},
    "adoptionImpact": {"type": "string", "description": "Impact on downstream adoption, in ACES-native terms."}
  }
}
